{
  "schema": "dscc.omc.capability/0.1",
  "node_label": "example-node",
  "devices": [
    {
      "id": "gpu0",
      "class": "gpu",
      "vendor": "example",
      "model": "example-gpu",
      "usable_memory_bytes": 4096,
      "supported_precisions": ["fp32"],
      "runtime_tags": ["reference-only"]
    }
  ],
  "network": {
    "class": "unknown",
    "down_mbps": 0,
    "up_mbps": 0,
    "latency_ms": 0
  },
  "policy": {
    "accepted_job_classes": ["inference"],
    "public_inference": false,
    "public_training": false,
    "max_job_seconds": 60
  }
}